{
  "versao": 1,
  "atualizadoEm": "2026-10-05",
  "aviso": "Estimativa paramétrica de estudo preliminar, não é orçamento. Os fatores local, estrutural e de estilo são estimativas a calibrar com orçamentos locais. Projeto e obra exigem responsável técnico com ART ou RRT.",
  "cub": {
    "uf": "CE",
    "fonte": "Sinduscon-CE",
    "url": "https://sindusconce.com.br/cub/",
    "norma": "ABNT NBR 12721:2006 (CUB/2006)",
    "mesRef": "2026-08",
    "publicadoEm": "2026-09-09",
    "coletadoEm": "2026-10-05",
    "arquivo": "https://sindusconce.com.br/wp-content/uploads/2026/09/2026-8-Relatorio-5-composicao-cub-m2-valores-em-reais-1.zip",
    "sha256Zip": "8f6225860897bfea385d5057d4fa698572986331b74ea3c7353354c7a1a27061",
    "onerado": {
      "R1-B": 2400.49,
      "R1-N": 2905.13,
      "R1-A": 3472.63,
      "R8-N": 2458.13
    },
    "desonerado": {
      "R1-B": 2269.16,
      "R1-N": 2723.15,
      "R1-A": 3275.17,
      "R8-N": 2313.49
    },
    "variacaoMes": {
      "R1-B": 1.43,
      "R1-N": 1.15,
      "R1-A": 0.82,
      "R8-N": 1.32
    },
    "composicao": {
      "R1-B": {
        "materiais": 1089.8,
        "maoDeObra": 1178.94,
        "administracao": 127.78,
        "equipamentos": 3.97
      },
      "R1-N": {
        "materiais": 1151.26,
        "maoDeObra": 1633.61,
        "administracao": 119.98,
        "equipamentos": 0.28
      },
      "R1-A": {
        "materiais": 1586.25,
        "maoDeObra": 1772.62,
        "administracao": 113.42,
        "equipamentos": 0.34
      }
    },
    "naoInclui": "Fundações, elevadores, equipamentos e instalações especiais, piscinas, urbanização e paisagismo, impostos e taxas, projetos e remuneração do construtor (NBR 12721)."
  },
  "referencias": {
    "sinapi": {
      "fonte": "IBGE · SINAPI (SIDRA)",
      "tabela": 2296,
      "variavel": 48,
      "uf": 23,
      "mesRef": "2026-08",
      "valor": 1883.2,
      "url": "https://apisidra.ibge.gov.br/values/t/2296/n3/23/v/48/p/last%201",
      "nota": "Custo médio do m² no Ceará; outra cesta de referência, usada só para conferir a tendência."
    },
    "incc": {
      "indice": "INCC-M",
      "fonte": "FGV IBRE",
      "url": "https://portal.fgv.br/noticias/incc-m-setembro-2026",
      "mesRef": "2026-09",
      "mes": 0.25,
      "acumAno": 5.86,
      "acum12m": 6.61,
      "serie": {
        "2026-08": 0.85,
        "2026-09": 0.25
      }
    }
  },
  "padroes": {
    "simples": {
      "nome": "Simples",
      "cub": "R1-B"
    },
    "intermediario": {
      "nome": "Intermediário",
      "cub": "R1-N"
    },
    "alto": {
      "nome": "Alto",
      "cub": "R1-A"
    }
  },
  "municipios": {
    "fortaleza": {
      "nome": "Fortaleza"
    },
    "eusebio": {
      "nome": "Eusébio"
    },
    "aquiraz": {
      "nome": "Aquiraz (sede)"
    },
    "portoDasDunas": {
      "nome": "Porto das Dunas (Aquiraz)"
    }
  },
  "coeficientes": {
    "garagem": {
      "nome": "Garagem coberta e subsolo de garagem",
      "min": 0.5,
      "med": 0.6,
      "max": 0.75,
      "origem": "NBR 12721: garagem (subsolo) de 0,50 a 0,75"
    },
    "varanda": {
      "nome": "Varandas",
      "min": 0.75,
      "med": 0.85,
      "max": 1,
      "origem": "NBR 12721: varandas de 0,75 a 1,00"
    },
    "terraco": {
      "nome": "Terraços e áreas descobertas sobre laje",
      "min": 0.3,
      "med": 0.45,
      "max": 0.6,
      "origem": "NBR 12721: terraços ou áreas descobertas sobre lajes de 0,30 a 0,60"
    },
    "areaTecnica": {
      "nome": "Caixa d'água e área técnica",
      "min": 0.5,
      "med": 0.6,
      "max": 0.75,
      "origem": "NBR 12721: caixa d'água e casa de máquinas de 0,50 a 0,75"
    },
    "piscina": {
      "nome": "Piscina (lâmina)",
      "min": 0.5,
      "med": 0.6,
      "max": 0.75,
      "origem": "NBR 12721: piscinas de 0,50 a 0,75"
    },
    "jardim": {
      "nome": "Quintais, calçadas e jardins",
      "min": 0.1,
      "med": 0.2,
      "max": 0.3,
      "origem": "NBR 12721: quintais, calçadas e jardins de 0,10 a 0,30"
    }
  },
  "fatores": {
    "logistica": {
      "fortaleza": {
        "min": 1,
        "med": 1,
        "max": 1,
        "origem": "Referência: o CUB-CE é apurado na região de Fortaleza."
      },
      "eusebio": {
        "min": 1.01,
        "med": 1.02,
        "max": 1.03,
        "origem": "Estimativa: deslocamento de equipes e fretes curtos a partir de Fortaleza."
      },
      "aquiraz": {
        "min": 1.02,
        "med": 1.035,
        "max": 1.05,
        "origem": "Estimativa: menor oferta local de mão de obra e materiais; fretes mais longos."
      },
      "portoDasDunas": {
        "min": 1.03,
        "med": 1.045,
        "max": 1.06,
        "origem": "Estimativa: logística litorânea, oferta local restrita e mão de obra que se desloca."
      }
    },
    "condominio": {
      "fortaleza": {
        "min": 1.01,
        "med": 1.02,
        "max": 1.03,
        "origem": "Estimativa: horário restrito, controle de acesso, caução e aprovação do projeto no condomínio."
      },
      "eusebio": {
        "min": 1.02,
        "med": 1.03,
        "max": 1.04,
        "origem": "Estimativa: condomínios horizontais com regras de obra, taxa de obra e aprovação prévia."
      },
      "aquiraz": {
        "min": 1.01,
        "med": 1.02,
        "max": 1.03,
        "origem": "Estimativa: regras de obra do condomínio."
      },
      "portoDasDunas": {
        "min": 1.02,
        "med": 1.03,
        "max": 1.04,
        "origem": "Estimativa: condomínios com regras de obra, horários e aprovação prévia."
      }
    },
    "marinho": {
      "ate500": {
        "nome": "Até 500 m do mar",
        "min": 1.05,
        "med": 1.065,
        "max": 1.08,
        "origem": "NBR 6118, classe de agressividade III/IV: cobrimentos de 35–50 mm, concreto C30–C40, a/c ≤ 0,55–0,45; esquadrias com pintura marinha e fixação em inox 316. Estimativa do acréscimo."
      },
      "de500a2000": {
        "nome": "De 500 m a 2 km do mar",
        "min": 1.01,
        "med": 1.02,
        "max": 1.03,
        "origem": "NBR 6118, classe II/III conforme a exposição; estimativa do acréscimo."
      },
      "acima2000": {
        "nome": "A mais de 2 km do mar",
        "min": 1,
        "med": 1,
        "max": 1,
        "origem": "Classe II (urbana), sem acréscimo."
      }
    },
    "estrutural": {
      "alvenariaEstrutural": {
        "nome": "Alvenaria estrutural",
        "norma": "NBR 16868",
        "min": 0.93,
        "med": 0.95,
        "max": 0.97,
        "vaoEcon": [
          4,
          5
        ],
        "vaoMax": 6,
        "balanco": 1,
        "prazo": "−10 a −15 %",
        "oferta": "Boa no Ceará",
        "restricoes": "Modulação de 15 ou 20 cm; paredes do superior sobre as do térreo; paredes não podem ser removidas em reformas.",
        "origem": "Estimativa: economia de 10 a 20 % na estrutura, que pesa de 15 a 20 % do custo."
      },
      "concretoArmado": {
        "nome": "Concreto armado",
        "norma": "NBR 6118",
        "min": 1,
        "med": 1,
        "max": 1,
        "vaoEcon": [
          4,
          6
        ],
        "vaoMax": 8,
        "balanco": 2,
        "prazo": "Referência",
        "oferta": "Ampla",
        "restricoes": "—",
        "origem": "Referência: o CUB R1 supõe estrutura convencional de concreto armado."
      },
      "lajeNervurada": {
        "nome": "Laje nervurada",
        "norma": "NBR 6118",
        "min": 1.02,
        "med": 1.035,
        "max": 1.05,
        "vaoEcon": [
          7,
          10
        ],
        "vaoMax": 12,
        "balanco": 2.5,
        "prazo": "Semelhante",
        "oferta": "Boa (cubetas e treliças)",
        "restricoes": "Altura de laje maior; pede forro ou pé-direito maior.",
        "origem": "Estimativa."
      },
      "protendido": {
        "nome": "Concreto protendido",
        "norma": "NBR 6118",
        "min": 1.06,
        "med": 1.08,
        "max": 1.1,
        "vaoEcon": [
          8,
          12
        ],
        "vaoMax": 15,
        "balanco": 4,
        "prazo": "Semelhante",
        "oferta": "Média (cordoalha engraxada)",
        "restricoes": "Projetista e equipe especializados; mobilização pesa em obra pequena.",
        "origem": "Estimativa."
      },
      "metalica": {
        "nome": "Estrutura metálica",
        "norma": "NBR 8800",
        "min": 1.08,
        "med": 1.115,
        "max": 1.15,
        "acrescimoLitoral": 0.03,
        "vaoEcon": [
          6,
          10
        ],
        "vaoMax": 15,
        "balanco": 5,
        "prazo": "−20 a −30 %",
        "oferta": "Média",
        "restricoes": "Proteção anticorrosiva (C4/C5 no litoral) e contra fogo.",
        "origem": "Estimativa."
      },
      "steelFrame": {
        "nome": "Steel frame e sistemas mistos",
        "norma": "NBR 14762",
        "min": 1,
        "med": 1.05,
        "max": 1.1,
        "vaoEcon": [
          3,
          5
        ],
        "vaoMax": 6,
        "balanco": 1.2,
        "prazo": "−30 a −40 %",
        "oferta": "Restrita no Ceará",
        "restricoes": "Galvanização Z275 ou maior no litoral; atenção à acústica.",
        "origem": "Estimativa."
      },
      "madeira": {
        "nome": "Madeira engenheirada (CLT/MLC), referência",
        "norma": "NBR 7190",
        "min": 1.2,
        "med": 1.275,
        "max": 1.35,
        "vaoEcon": [
          4,
          6
        ],
        "vaoMax": 8,
        "balanco": 2,
        "prazo": "−30 %",
        "oferta": "Muito baixa no Ceará (frete do Sul)",
        "restricoes": "Umidade e cupim; só como referência.",
        "origem": "Estimativa."
      }
    },
    "vaosMaiores": {
      "min": 1.03,
      "med": 1.045,
      "max": 1.06,
      "origem": "Estimativa: vigas e lajes mais altas para vencer o vão máximo do sistema sem pilar intermediário."
    },
    "estilo": {
      "caraDeCasa": {
        "nome": "Casa com cara de casa",